{
  "capacity": {
    "id": "CAP-ORG-ESTRUT-COMPET-005",
    "name": "Sistemas de metas motivacionais",
    "block": "Organização",
    "pilar": "Estrutura e Gestão",
    "dimension": "Competência de Liderança",
    "description": "Capacidade dos líderes de estabelecer, comunicar e gerenciar sistemas de metas que motivam e engajam os colaboradores na transformação para Indústria 4.0. Inclui a habilidade de alinhar objetivos individuais, de equipe e organizacionais; definir metas baseadas em dados; promover autonomia e ownership; fornecer feedback contínuo; e adaptar metas dinamicamente ao contexto de negócios. Esta capacidade mede o quanto a liderança é capaz de criar um ambiente onde metas claras, desafiadoras e motivacionais impulsionam a transformação digital. Estilo de liderança democrático, Gestão ágil, Estratégia & Governança, Colaboração Inter e Intraempresarial, Workforce Learning & Development, Abertura à inovação",
    "related_capacities": [
      "Estilo de liderança democrático",
      "Gestão ágil",
      "Estratégia & Governança",
      "Colaboração Inter e Intraempresarial",
      "Workforce Learning & Development",
      "Abertura à inovação"
    ],
    "metadata": {
      "source_frameworks": [
        "ACATECH",
        "SIRI"
      ],
      "author": "Ewerton Madruga",
      "version": "1.0",
      "last_updated": "2026-01-05",
      "source_docx": "20251105_Checklist_Maturidade_Metas_Motivacionais_ESTENDIDO.docx",
      "status": "draft"
    }
  },
  "questions": [
    {
      "id": "Q-ORG-ESTRUT-COMPET-005-001",
      "question_number": 1,
      "title": "Sistemas de Metas Motivacionais",
      "text": "Como a liderança estabelece e gerencia sistemas de metas para motivar e engajar a equipe na transformação para Indústria 4.0?",
      "maturity_levels": [
        {
          "level": 0,
          "label": "Nível 0",
          "description": "Não existem metas formais relacionadas à Indústria 4.0. Liderança não estabelece objetivos claros para a transformação digital.",
          "evidence_signals": {
            "observable_behaviors": [
              "sem metas formais para Indústria 4",
              "iniciativas ad-hoc ou ausentes"
            ]
          }
        },
        {
          "level": 1,
          "label": "Nível 1",
          "description": "Liderança define metas de forma unilateral e top-down, comunicadas informalmente. Sem mecanismos de acompanhamento ou feedback.",
          "evidence_signals": {
            "observable_behaviors": [
              "metas definidas unilateralmente pela liderança",
              "comunicação informal",
              "sem acompanhamento estruturado",
              "colaboradores desconhecem ou não se engajam"
            ]
          }
        },
        {
          "level": 2,
          "label": "Nível 2",
          "description": "Liderança define metas formais e as comunica através de canais oficiais, mas sem envolvimento da equipe na definição. Acompanhamento anual ou semestral.",
          "evidence_signals": {
            "observable_behaviors": [
              "metas definidas top-down com comunicação formal",
              "acompanhamento anual/semestral",
              "alinhamento fraco",
              "feedback esporádico",
              "reconhecimento pontual"
            ]
          }
        },
        {
          "level": 3,
          "label": "Nível 3",
          "description": "Liderança define metas em consulta com as equipes, com alinhamento parcial entre objetivos individuais e organizacionais. Feedback periódico (trimestral) e sistema básico de reconhecimento.",
          "evidence_signals": {
            "observable_behaviors": [
              "consulta às equipes na definição",
              "alinhamento parcial documentado",
              "revisões trimestrais",
              "feedback periódico",
              "sistema básico de reconhecimento",
              "motivação moderada"
            ]
          }
        },
        {
          "level": 4,
          "label": "Nível 4",
          "description": "Liderança co-cria metas com as equipes baseadas em dados, promovendo alinhamento claro entre objetivos individuais, de equipe e organizacionais. Feedback contínuo (mensal) e reconhecimento estruturado.",
          "evidence_signals": {
            "observable_behaviors": [
              "co-criação de metas com dados",
              "alinhamento claro e documentado",
              "dashboards digitais",
              "feedback contínuo (mensal)",
              "reconhecimento estruturado",
              "alta motivação",
              "metas revisadas com base em contexto"
            ]
          }
        },
        {
          "level": 5,
          "label": "Nível 5",
          "description": "Liderança estabelece sistema ágil de metas com ciclos curtos, alta autonomia das equipes, dashboards com dados em tempo real, análises preditivas e reconhecimento personalizado. Metas adaptam-se dinamicamente ao contexto.",
          "evidence_signals": {
            "observable_behaviors": [
              "sistema ágil com ciclos curtos (sprints)",
              "alta autonomia",
              "dashboards com tempo real e analytics preditivos",
              "reconhecimento personalizado e automatizado",
              "ajustes dinâmicos baseados em dados",
              "motivação intrínseca"
            ]
          }
        },
        {
          "level": 6,
          "label": "Nível 6",
          "description": "Liderança atua como facilitadora de sistema totalmente integrado onde equipes autogerenciáveis definem e ajustam metas continuamente com base em dados em tempo real, transparência total, feedback automatizado e celebração de conquistas. Motivação intrínseca sustentável.",
          "evidence_signals": {
            "observable_behaviors": [
              "autogestão completa",
              "times definem e ajustam metas continuamente",
              "transparência total",
              "feedback e reconhecimento em tempo real",
              "cultura de metas integrada",
              "celebração sistemática de conquistas",
              "metas adaptativas com ajustes automáticos"
            ]
          }
        }
      ],
      "evidence_sources": {
        "artifacts": [
          "Artefatos e onde buscar Documentos de definição de metas (OKRs, KPIs, Balanced Scorecard) com evidências de autoria e participação. Matriz de alinhamento mostrando conexão entre metas individuais → equipe → organização. Dashboards de acompanhamento (frequência de atualização, nível de acesso). Atas de reuniões de definição, revisão e ajuste de metas (1:1s, team meetings, all-hands). Registros de feedback (formulários, sistemas de avaliação). Programas de reconhecimento (critérios, frequência, exemplos). PDIs (Planos de Desenvolvimento Individual) vinculados a metas. Comunicações sobre metas (e-mails, intranet, apresentações)."
        ],
        "metrics": [
          "Métricas/KPIs % de colaboradores que conhecem suas metas e entendem como contribuem para objetivos organizacionais (pesquisa). Taxa de alinhamento entre metas (individual/equipe/organização). Frequência de definição, revisão e ajuste de metas. % de metas com métricas quantitativas e fontes de dados definidas. % de metas co-criadas vs. impostas. Índice de engajamento e motivação (pesquisa eNPS, clima). Taxa de alcance de metas. Frequência de feedback formal e informal. % de colaboradores que receberam reconhecimento vinculado a metas. Tempo de resposta entre mudança estratégica e ajuste de metas. Índice de autonomia (pesquisa sobre ownership das metas). Taxa de uso de dashboards e ferramentas de acompanhamento."
        ],